{"$schema":"https://json-schema.org/draft/2020-12/schema","$id":"https://example.invalid/schemas/work-package-catalog.schema.json","type":"object","additionalProperties":false,"required":["schema_version","canonicalization_version","catalog_id","catalog_revision","policy","work_packages"],"properties":{"schema_version":{"const":1},"canonicalization_version":{"const":1},"catalog_id":{"type":"string"},"catalog_revision":{"type":"integer","minimum":0},"policy":{"type":"object"},"work_packages":{"type":"array","minItems":1,"items":{"$ref":"#/$defs/work_package"}}},"$defs":{"work_package":{"type":"object","additionalProperties":false,"required":["id","title","capability_area","status","current_state","target_state","business_value","source_scope","must_deliver","must_preserve","definition_of_done","split_policy"],"properties":{"id":{"type":"string","pattern":"^KB-WP-[0-9]{3}$"},"title":{"type":"string","minLength":5},"capability_area":{"type":"string","minLength":3},"status":{"enum":["active","ready","blocked","completed","superseded"]},"current_state":{"type":"object","required":["verified_description","evidence_refs"],"properties":{"verified_description":{"type":"string","minLength":10},"evidence_refs":{"type":"array"}}},"target_state":{"type":"object","required":["measurable_description","excluded_claims"],"properties":{"measurable_description":{"type":"string","minLength":10},"excluded_claims":{"type":"array"}}},"business_value":{"type":"string","minLength":5},"source_scope":{"type":"object","required":["preferred_source_types","applicable_elementor_versions","freshness_requirements"],"properties":{"preferred_source_types":{"type":"array","minItems":1},"applicable_elementor_versions":{"type":"array","minItems":1},"freshness_requirements":{"type":"array","minItems":1}}},"must_deliver":{"type":"array","minItems":5},"must_preserve":{"type":"array","minItems":3},"definition_of_done":{"type":"array","minItems":5},"split_policy":{"type":"object"}}}}}